{
  "artifactKind": "evidence-report",
  "schemaVersion": "1",
  "contractVersion": "1",
  "status": "UNKNOWN",
  "verdict": "UNKNOWN",
  "verdictDetail": "External engine evidence is unavailable in this fixture.",
  "exitClassification": "UNKNOWN",
  "generatedAt": "2026-08-22T00:00:00Z",
  "observedAt": "2026-08-22T00:00:00Z",
  "evidenceLevel": "E4",
  "readiness": {
    "owner": "fixture-owner",
    "environment": "production",
    "deployment": "fixture-production-2026-08-22",
    "locale": "en",
    "url": "https://example.com/guide",
    "property": "sc-domain:example.com",
    "cohort": "guide-2026-08-22",
    "denominator": 1,
    "timestamp": "2026-08-22T00:00:00Z",
    "observedAt": "2026-08-22T00:00:00Z",
    "source": "fixture and documented platform observations",
    "evidence": [{ "level": "E2", "source": "HTTP fixture", "observedAt": "2026-08-22T00:00:00Z" }],
    "declared_indexable": { "status": "PASS", "evidenceLevel": "E2", "source": "served production HTML and response metadata", "observedAt": "2026-08-22T00:00:00Z", "cohort": "guide-2026-08-22", "denominator": 1, "value": true },
    "http_fetchable": { "status": "PASS", "evidenceLevel": "E2", "source": "HTTP response and headers", "observedAt": "2026-08-22T00:00:00Z", "cohort": "guide-2026-08-22", "denominator": 1, "value": 200 },
    "rendered_content_available": { "status": "UNKNOWN", "evidenceLevel": "E2", "source": "browser render not run", "observedAt": "2026-08-22T00:00:00Z", "cohort": "guide-2026-08-22", "denominator": 1 },
    "canonical_consistent": { "status": "UNKNOWN", "evidenceLevel": "E2", "source": "engine canonical not observed", "observedAt": "2026-08-22T00:00:00Z", "cohort": "guide-2026-08-22", "denominator": 1 },
    "engine_indexed": { "status": "UNKNOWN", "evidenceLevel": "E4", "source": "URL Inspection unavailable", "observedAt": "2026-08-22T00:00:00Z", "cohort": "guide-2026-08-22", "denominator": 1 },
    "search_visible": { "status": "UNKNOWN", "evidenceLevel": "E4", "source": "Search Console unavailable", "observedAt": "2026-08-22T00:00:00Z", "cohort": "guide-2026-08-22", "denominator": 1 },
    "ai_cited": { "status": "UNKNOWN", "evidenceLevel": "E4", "source": "answer-engine observation unavailable", "observedAt": "2026-08-22T00:00:00Z", "cohort": "guide-2026-08-22", "denominator": 1 },
    "referred": { "status": "UNKNOWN", "evidenceLevel": "E5", "source": "referral analytics unavailable", "observedAt": "2026-08-22T00:00:00Z", "cohort": "guide-2026-08-22", "denominator": 1 },
    "converted": { "status": "UNKNOWN", "evidenceLevel": "E5", "source": "first-party conversion analytics unavailable", "observedAt": "2026-08-22T00:00:00Z", "cohort": "guide-2026-08-22", "denominator": 1 }
  },
  "evidence": [{ "level": "E4", "source": "fixture evidence", "observedAt": "2026-08-22T00:00:00Z" }],
  "limitations": ["Engine observations are unavailable in this fixture."],
  "configHash": null,
  "sourceRevision": { "revision": null, "dirty": null },
  "checks": [],
  "failures": [],
  "unknowns": ["Google URL Inspection unavailable", "conversion cohort not connected"],
  "delta": null,
  "sources": [{ "publisher": "Google", "directUrl": "https://developers.google.com/search/docs/fundamentals/ai-optimization-guide", "supportedClaim": "Google's published AI-search guidance", "verifiedAt": "2026-08-22" }],
  "geoFunnel": {
    "crawlerAccess": { "status": "PASS", "evidenceLevel": "E2", "numerator": 1, "denominator": 1, "cohort": "bots-2026-08-22", "source": "HTTP access log fixture", "observedAt": "2026-08-22T00:00:00Z" },
    "eligibilityIndexing": { "status": "UNKNOWN", "evidenceLevel": "E4", "numerator": null, "denominator": null, "cohort": "url-2026-08-22", "source": "URL Inspection unavailable", "observedAt": "2026-08-22T00:00:00Z" },
    "impressionsVisibility": { "status": "UNKNOWN", "evidenceLevel": "E5", "numerator": null, "denominator": null, "cohort": "queries-2026-08-22", "source": "Search Console unavailable", "observedAt": "2026-08-22T00:00:00Z" },
    "citation": { "status": "UNKNOWN", "evidenceLevel": "E4", "numerator": null, "denominator": null, "cohort": "answers-2026-08-22", "source": "answer-engine observations unavailable", "observedAt": "2026-08-22T00:00:00Z" },
    "referral": { "status": "UNKNOWN", "evidenceLevel": "E5", "numerator": null, "denominator": null, "cohort": "utm-2026-08-22", "source": "first-party referral analytics unavailable", "observedAt": "2026-08-22T00:00:00Z" },
    "conversionRetention": { "status": "UNKNOWN", "evidenceLevel": "E5", "numerator": null, "denominator": null, "cohort": "activation-2026-08-22", "source": "first-party conversion analytics unavailable", "observedAt": "2026-08-22T00:00:00Z" }
  }
}
