{
  "artifactKind": "evidence-report",
  "schemaVersion": "1",
  "contractVersion": "1",
  "status": "UNKNOWN",
  "verdict": "UNKNOWN",
  "verdictDetail": "External engine and publisher-console evidence is unavailable in this fixture.",
  "exitClassification": "UNKNOWN",
  "generatedAt": "2026-08-22T00:00:00Z",
  "observedAt": "2026-08-22T00:00:00Z",
  "evidenceLevel": "E1",
  "readiness": {
    "owner": "unknown",
    "environment": "local",
    "deployment": null,
    "locale": "unknown",
    "url": "https://example.com/new-page",
    "property": "sc-domain:example.com",
    "cohort": "new-page-2026-08-22",
    "denominator": null,
    "timestamp": "2026-08-22T00:00:00Z",
    "observedAt": "2026-08-22T00:00:00Z",
    "source": "local fixture only",
    "evidence": [{ "level": "E1", "source": "local fixture", "observedAt": "2026-08-22T00:00:00Z" }],
    "declared_indexable": { "status": "UNKNOWN", "evidenceLevel": "E1", "source": "missing external data", "observedAt": "2026-08-22T00:00:00Z", "cohort": "new-page-2026-08-22", "denominator": null },
    "http_fetchable": { "status": "UNKNOWN", "evidenceLevel": "E1", "source": "missing external runtime data", "observedAt": "2026-08-22T00:00:00Z", "cohort": "new-page-2026-08-22", "denominator": 1 },
    "rendered_content_available": { "status": "UNKNOWN", "evidenceLevel": "E1", "source": "missing browser evidence", "observedAt": "2026-08-22T00:00:00Z", "cohort": "new-page-2026-08-22", "denominator": null },
    "canonical_consistent": { "status": "UNKNOWN", "evidenceLevel": "E1", "source": "missing external data", "observedAt": "2026-08-22T00:00:00Z", "cohort": "new-page-2026-08-22", "denominator": null },
    "engine_indexed": { "status": "UNKNOWN", "evidenceLevel": "E1", "source": "missing external data", "observedAt": "2026-08-22T00:00:00Z", "cohort": "new-page-2026-08-22", "denominator": null },
    "search_visible": { "status": "UNKNOWN", "evidenceLevel": "E1", "source": "missing external data", "observedAt": "2026-08-22T00:00:00Z", "cohort": "new-page-2026-08-22", "denominator": null },
    "ai_cited": { "status": "UNKNOWN", "evidenceLevel": "E1", "source": "missing external data", "observedAt": "2026-08-22T00:00:00Z", "cohort": "new-page-2026-08-22", "denominator": null },
    "referred": { "status": "UNKNOWN", "evidenceLevel": "E1", "source": "missing external data", "observedAt": "2026-08-22T00:00:00Z", "cohort": "new-page-2026-08-22", "denominator": null },
    "converted": { "status": "UNKNOWN", "evidenceLevel": "E1", "source": "missing external data", "observedAt": "2026-08-22T00:00:00Z", "cohort": "new-page-2026-08-22", "denominator": null }
  },
  "evidence": [{ "level": "E1", "source": "local fixture", "observedAt": "2026-08-22T00:00:00Z" }],
  "limitations": ["No owner property or publisher console is connected."],
  "configHash": null,
  "sourceRevision": { "revision": null, "dirty": null },
  "checks": [],
  "failures": [],
  "unknowns": ["missing external data: Search Console, publisher consoles, and AI visibility are UNKNOWN"],
  "delta": null,
  "sources": [{ "publisher": "Google", "directUrl": "https://support.google.com/webmasters/answer/16984139?hl=en", "supportedClaim": "No generative report is available in this fixture", "verifiedAt": "2026-08-22" }],
  "geoFunnel": {
    "crawlerAccess": { "status": "UNKNOWN", "evidenceLevel": "E1", "numerator": null, "denominator": null, "cohort": "not available", "source": "missing external data", "observedAt": "2026-08-22T00:00:00Z" },
    "eligibilityIndexing": { "status": "UNKNOWN", "evidenceLevel": "E1", "numerator": null, "denominator": null, "cohort": "not available", "source": "missing external data", "observedAt": "2026-08-22T00:00:00Z" },
    "impressionsVisibility": { "status": "UNKNOWN", "evidenceLevel": "E1", "numerator": null, "denominator": null, "cohort": "not available", "source": "missing external data", "observedAt": "2026-08-22T00:00:00Z" },
    "citation": { "status": "UNKNOWN", "evidenceLevel": "E1", "numerator": null, "denominator": null, "cohort": "not available", "source": "missing external data", "observedAt": "2026-08-22T00:00:00Z" },
    "referral": { "status": "UNKNOWN", "evidenceLevel": "E1", "numerator": null, "denominator": null, "cohort": "not available", "source": "missing external data", "observedAt": "2026-08-22T00:00:00Z" },
    "conversionRetention": { "status": "UNKNOWN", "evidenceLevel": "E1", "numerator": null, "denominator": null, "cohort": "not available", "source": "missing external data", "observedAt": "2026-08-22T00:00:00Z" }
  }
}
